,asin,category,color,description,details,name,size,department,demographic,division,subcategory,type,detail_type
595,B00ABBPDLY, Active ,missing,"45% Acrylic, 40% Merino Wool, 13% Nylon, 2% Spandex Made in US Machine Wash This is a 3 pair pack of socks Sock size s - shoe size 9-1 - age 3-7 yrs Sock size m - shoe size 12-6 - age 5-10 yrs Sock size l - shoe size 6-9 - age 10-adult",missing,Jefferies Socks Little Boys' Wool Boot Socks  (Pack of 3),missing,"Clothing, Shoes & Jewelry ", Boys , Clothing ,Athletic Socks,,
603,B00ABKSGSC, Scarves & Wraps ,missing,"Tapp Collections is a registered trademark (Reg. No. 5,030,606) owned and operated by Tapp Collections, Inc. Tapp Collections products are sold exclusively by Tapp Collections authorized retailers. Any registered trademark (Reg. No. 5,030,606) infringement will be reported to Amazon. Soft texture fabric Synthetic pashmina Size : 28"" x 71"" long; weight : 5.6 oz ** Various Styles ** Quantity Discounts Available **",missing,Tapp Collections™ Premium Fashion Animal Print Shawl Scarf Wrap,missing,"Clothing, Shoes & Jewelry ", Women , Accessories ,Fashion Scarves,,
608,B00ABW5MUA, Gloves & Mittens ,missing,* Pigskin Suede leather * Rabbit fur trim,missing,Warmen Women's Pigskin Suede Leather Winter Lined Gloves Rabbit Fur Trim,missing,"Clothing, Shoes & Jewelry ", Women , Accessories ,Cold Weather Gloves,,
619,B00ACIFB90, Underwear ,missing,100% Cotton Machine Wash Premium ComfortSoft cotton fabric is super soft Fresh IQ advanced odor protection technology attacks odor-causing bacteria in your clothing to help you feel fresh all day Tagless for itch-free comfort Preshrunk cotton for a lasting fit Generous length for a stay-tucked hem 6-pack,missing,Hanes Ultimate Men's 6-Pack FreshIQ V-Neck Tee,missing,"Clothing, Shoes & Jewelry ", Men , Clothing ,Undershirts,,
621,B00ACIFCOE, Underwear ,unavailable,100% Cotton undershirts closure Machine Wash Premium ComfortSoft cotton fabric is super soft Tagless for itch-free comfort Preshrunk cotton for a lasting fit Generous length for a stay-tucked hem,missing,Hanes Ultimate Men's 3-Pack Classics Black V-Neck Tee,missing,"Clothing, Shoes & Jewelry ", Men , Clothing ,Undershirts,,
622,B00ACIFDS4, Underwear ,missing,"100% Cotton Machine Wash Our classic white crewneck t-shirt-now in bigger, taller sizes Pure, ultra-soft cotton Tagless Lay flat collar and preshrunk for a lasting fit 9856w2",missing,Hanes Ultimate Men's 2-Pack Tall Man Crew Neck Tee,missing,"Clothing, Shoes & Jewelry ", Men , Clothing ,Undershirts,,
624,B00ACIFHBC, Underwear ,unavailable,100% Cotton Machine Wash Premium ComfortSoft cotton fabric is super soft Supersoft ring-spun cotton Tagless for itch-free comfort ComfortFlex waistband that keeps it shape Full-cut for comfort Cotton/polyester,missing,Hanes Ultimate Men's 7-Pack Full-Cut Pre-Shrunk Briefs - Colors May Vary,missing,"Clothing, Shoes & Jewelry ", Men , Clothing ,Briefs,,
628,B00ACIFL9U, Underwear ,missing,"Solids: 100% Cotton Imported boxers closure Machine Wash Our premium ComfortFlex waistband is soft and stretchable Made with our 100% premium cotton, ComfortSoft fabric is the ultimate in comfort Tag-free for itch-free comfort",missing,Hanes Men's 5-Pack Ultimate  Dyed Exposed Waistband Knit Boxer with ComfortFlex Waistband -  Assorted Colors,missing,"Clothing, Shoes & Jewelry ", Men , Clothing ,Boxers,,
630,B00ACIH9SG, Underwear ,missing,"55% Cotton, 45% Polyester Imported Pull On closure Machine Wash Supersoft ring spun cotton / polyester blend Premium, Comfort Flex waistband that keeps its shape - no pinching and binding Full cut for added comfort",missing,Hanes Ultimate Men's 5-Pack Yarn Dye Exposed Waistband Boxer-Colors May Vary,missing,"Clothing, Shoes & Jewelry ", Men , Clothing ,Boxers,,
631,B00ACIHBV6, Underwear ,missing,"55% Cotton, 45% Polyester Imported Pull On closure Machine Wash Supersoft ring spun cotton / polyester blend Premium, Comfort Flex waistband that keeps its shape - no pinching and binding Full cut for added comfort",missing,Hanes Ultimate Men's 5-Pack Yarn Dye Exposed Waistband Boxer-Colors May Vary,missing,"Clothing, Shoes & Jewelry ", Men , Clothing ,Boxers,,
633,B00ADCB51I, Women ,missing,"55% Polyester, 35% Cotton, 10% Spandex Line Dry Brushed fleece lining throughout the interior for extra softness and warmth Stay warm without adding extra bulk Doubles as an undershirt or pajama top General sizing guide corresponding to US dress size: S (0-2), M (4-6), L (8-10), XL (12-14), 2XL (16-18) Hand wash, line dry.",missing,Angelina Women's Fleece Lined Long Sleeve Thermal Top,missing,Sports & Outdoors , Sports & Fitness , Clothing ,Shirts,,
638,B00ADHI80Y," Tops, Tees & Blouses ",missing,PLEASE CHOOSE YOUR SIZE BASED ON BUST MEASUREMENT BELOW Bust (S)33-35 inches (M)35-37 inches (L)38-40 inches (XL)40-42 inches Length(shoulder to bottom hem) (S)24.5 inches (M)25.5 inches (L)26.5 inches (XL)27.5 inches Sleeve Length(shoulder to cuff hem) (S)25 inches (M)25.5 inches (L)26 inches (XL)26.5 inches. Garment Care: Hand-wash only. Fabric: Body: 95% Rayon 5% Spandex; Sleeves: 100% Polyester. Model in pictures is 5 feet 8 inches (173cm) tall.,missing,PattyBoutik Women's Chiffon Slit Bishop Long Sleeve Blouse,missing,"Clothing, Shoes & Jewelry ", Women , Clothing ,Blouses & Button-Down Shirts,,
640,B00ADI0KOK, Novelty ,unavailable,"High-quality artificial leather Look slimmer，nice to get fit,suitable for all kinds of occasions Perfect for cinching a cardigan or sundress and other different style Snap Button Closure easy to wear on/off Stylish and goes with both casual and dressy wear",missing,HOTER Black Lace-up Corset Style Elastic Cinch Belt,missing,"Clothing, Shoes & Jewelry ", Novelty & More , Clothing , Women , Accessories ,Belts
649,B00AE1JTAM, Shorts ,missing,Fabric content varies by color. Please select color above to see fabric content. Imported Machine Wash Mid rise 5 inch inseam,missing,Levi's Women's Pieced Pocket Short,missing,"Clothing, Shoes & Jewelry ", Women , Clothing ,Casual,,
653,B00AE275T8, Sweaters ,missing,Gender: Girl's Ladies Material: Mecerized Cotton Style: Fashion Style: Sweaters Country of Manufacture: China,missing,Xfy Beautiful Knitting Weaveing Women Lady Cardigan Sweater Long Sleeve Candy Colors,missing,"Clothing, Shoes & Jewelry ", Women , Clothing ,Cardigans,,
655,B00AEA0HMM, Outdoor ,missing,"100% Synthetic Imported Rubber sole Shaft measures approximately 6"" from arch Heel measures approximately 2"" Insulated winter boot featuring secure lace-up shaft with quick-lace hardware at top and pull loop at back Seam-sealed waterproof upper",missing,Columbia Men's Bugaboot Snow Boot,missing,"Clothing, Shoes & Jewelry ", Men , Shoes ,Snow Boots,,
662,B00AEJPLH4, Clothing ,missing,"100% Cotton Machine Wash Cargo short featuring multiple pockets and drawstring legs Striped belt with D-ring closure Inseam: 13.5""",missing,Southpole Men's Basic Cargo Short,missing,"Clothing, Shoes & Jewelry ", Men ," Surf, Skate & Street ", Shorts ,Cargo,
663,B00AEKWRFM, Boots ,missing,Synthetic Rubber Sole Faux Leather Upper Great for everyday wear Breckelles Shoes - Fashion-Forward Shoes Quality Man Made Materials,missing,Breckelle's Sandy-62 Basic Casual Cuffed Lace Up Flat Ankle Bootie Boot,missing,"Clothing, Shoes & Jewelry ", Women , Shoes ,Ankle & Bootie,,
700,B00AFZCNKA, Athletic ,missing,100% synthetic Rubber sole Designed for neutral-t to under-pronation YourFlex lightweight construction with RealFlex-derived outsole nodes for natural motion EVA foam midsole Lightweight flexibility meets natural motion thanks to articulated pods in the sole.,missing,Reebok Women's YourFlex Run 4.0 Running Shoe,missing,"Clothing, Shoes & Jewelry ", Women , Shoes , Running ,Road Running,
725,B00AHFIZBO, Clothing ,missing,"100% Polyester Imported Armour Fleece construction delivers a brushed inner layer and a smooth, quick-dry outer layer Material wicks sweat & dries really fast Mesh lined, two-piece hood with crossover neck for enhanced comfort Raglan sleeves unlock mobility for serious range of motion Shaped drop-tail hem offer superior back coverage",missing,Under Armour Girls' Armour Fleece Big Logo Hoodie,missing,Sports & Outdoors , Sports & Fitness , Exercise & Fitness , Girls ,"Shirts, Tanks & Tees",
726,B00AHH8KDK,Fashion Sneakers,missing,"100% Synthetic/Textile Imported Rubber sole Heel measures approximately 1.75"" Functional hook-and-loop",missing,Skechers Sport Women's Kick Back Fashion Sneaker,missing,"Clothing, Shoes & Jewelry ", Women , Shoes ,,,
727,B00AHHW48C, Active ,missing,"93% Nylon, 7% Spandex Imported Each set includes three pairs of spandex active shorts 1 inch ribbed waistband for maximum comfort 4 inch inseam Our most versatile compression short perfect for many occasions Order a size up to ensure an opaque, non-see through look",missing,OPPA! Women's 3 Pack Seamless Active Spandex Dance Workout Yoga Shorts,missing,"Clothing, Shoes & Jewelry ", Women , Clothing ,Active Shorts,,
729,B00AHJL2ZG,Fashion Sneakers,missing,"100% Mesh Imported Rubber sole Heel measures approximately 1"" Easygoing slip-on in mesh with lightweight, flexible sole and memory foam insole",missing,Skechers Sport Women's EZ Flex Take It Easy Slip-On Fashion Sneaker,missing,"Clothing, Shoes & Jewelry ", Women , Shoes ,,,
733,B00AHOQ62K, Clothing ,unavailable,100% Cotton Machine Wash Two-pack of footed jumpsuits in duck motif featuring zip front with snap closure,missing,Gerber Unisex-Baby Two-Pack Sleep-N-Play Zip-Front Ducks Jumpsuits,missing,"Clothing, Shoes & Jewelry ", Baby , Baby Girls , Sleepwear & Robes ,Blanket Sleepers,
740,B00AHRDKOO," Lingerie, Sleep & Lounge ",missing,95% Nylon/5% Spandex Imported Pull On closure Machine Wash Moisture Management technology and knit in ventilating mesh help keep you cool and dry Knit-in inner bra and wide bottom band provide additional support Seamless design to minimize chafing and 4-way stretch to maximize comfort,missing,Champion Women's Freedom Seamless Racerback Sport Bra,missing,"Clothing, Shoes & Jewelry ", Women , Clothing , Lingerie , Bras ,Sports Bras
753,B00AILFRPY," Coats, Jackets & Vests ",missing,"100% Nylon Machine Wash 2-ounce, 100 percentage nylon oxford with rain defender durable water-repellent finish Polyester mesh lining in body, taffeta lining in sleeves Attached three-piece hood with draw cord adjuster Chest pocket with secure zipper closure Side entry pockets with snap closures",missing,Carhartt Women's Rockford Windbreaker,missing,"Clothing, Shoes & Jewelry ", Women , Clothing ," Trench, Rain & Anoraks ",Raincoats,
754,B00AIXSWFE, Necklaces ,unavailable,"This price is for EIGHT necklaces! This adjustable necklace measures 19-22 inches. This pendant measures 2 inches from left to right and top to bottom. Great Quality Jewelry! Ships from USA, Guaranteed!",missing,JOTW 8 Pieces of Silvertone Butterfly Design Pink Stoned Pendant with a 22 Inch Adjustable Link Chain Necklace (X-1470),missing,"Clothing, Shoes & Jewelry ", Women , Jewelry ,Pendants,,
756,B00AJ01OJC, Wedding & Engagement ,unavailable,"Please place your ring sizes in the gift message section of your purchase His & Her's 8MM/6MM Dragon Design Tungsten Carbide Wedding Band Ring Set (Available Sizes 5-14 Including Half Sizes) Intricate Celtic Dragon Design ,Genuine Authentic, Best Price you can find for a set ring. Width: 8MM for Him & Width: 6MM for Her , New Tungsten Dragon Bracelet ASIN : B00H3O4016 We Offer you Laser Engraving, Please ad to the cart ASIN: B00JJXQAV2",missing,His & Her's 8MM/6MM Tungsten Carbide Celtic Knot Dragon and Carbon Fiber Inlay Wedding Band Ring Set,missing,"Clothing, Shoes & Jewelry ", Women , Jewelry ,Bridal Sets,,
757,B00AJ0E7B4, Jackets & Coats ,missing,"Nylon,Polyester Made in USA or Imported Machine Wash ADVANCED TECHNOLOGY: This boys' winter jacket features 100% polyester down lining and a Omni-Shield water and stain resistant shell for ultimate warmth and comfort. HANDY FEAUTRES: This boys' winter down jacket features two zippered hand pockets. ADJUSTABLE FEATURES: This boys' winter down jacket features an adjustable storm hood. VERSATILE FIT: This winter jacket's down-style baffling lends a timeless, versatile fit. This boy's puffer jacket features and Omni-Shield advanced repellency to sheds water and wards off stains and polyester faux down insulation to keep your little one warm",missing,Columbia  Boys' Powder Lite Puffer,missing,"Clothing, Shoes & Jewelry ", Boys , Clothing ,Down & Down Alternative,,
760,B00AJ2YDZC,Wrist Watches,unavailable,Three sub-dials in right big case just for decoration without function This watch is much larger than normal suit for bigger wrist. Compass will function when placed horizontally,missing,Oulm Compass Outdoor Sports Watches Analog Dark Brown Leather Strap Four Sub-dials Men Watch,missing,"Clothing, Shoes & Jewelry ", Men , Watches ,,,
770,B00AJI0S50, Clothing ,missing,"58% Silk/42% Linen Imported Dry Clean Only Tracy Reese revives retro sensibilities with the Deconstructed dress featuring an A-line skirt, bateau neck, and pretty petticoat. Raw material edge at neckline, sleeves, and bottom of skirt Deep V-neck in back with zipper and tie-back sash 58% silk/42% linen",missing,Tracy Reese Women's Deconstructed Frock,missing,"Clothing, Shoes & Jewelry ", Women , Contemporary & Designer , Dresses ,Casual,
772,B00AJK9CW8, Men ,unavailable,"Imported Stainless steel watch featuring black dial with triangular hour markers, notched bezel, and day/date display at 3 o'clock 42.5 mm stainless steel case with Hardlex dial window Japanese automatic movement with Analog display Stainless steel link bracelet with fold-over clasp Water resistant to 200 m (660 ft): In general, suitable for professional marine activity and serious surface water sports, but not scuba diving",missing,Seiko Men's SRP307 Classic Automatic Stainless Steel Dive Watch,missing,Sports & Outdoors , Outdoor Recreation , Outdoor Clothing , Accessories ,Sport Watches,
779,B00AJNB912, Athletic ,missing,"100% Synthetic Imported Rubber sole ASICS® newest innovative training shoe built for the athlete looking for that edge to tackle their most extreme training. From rope climbs to body-weight workouts, the GEL-Fortius™ TR will give you the fortitude and strength you need to conquer your toughest workouts! Breathable air mesh uppers with abrasion-resistant medial and quarter panel overlays for support. Foam-padded collar with webbing heel pull loop. Mesh lining and an EVA ""Be Better Than Yesterday."" sockliner. Traditional lacing closure with tongue pull loop for a secure fit and easy entry. Built on a narrower *last for that next-to-skin, glove-like fit.For wide feet, Asics recommends you order a half-size up for better fit. Double-stitched quarter-panel brace supports the foot during quick lateral movements. Stitched-down, reinforced RhynoSkin® to cap provides maximum durability for the toughest workouts. Low-profile midsole keeps you grounded while doing lifts. High-traction, non-marking rubber",missing,ASICS Men's Gel-Fortius TR Cross-Training Shoe,missing,"Clothing, Shoes & Jewelry ", Men , Shoes ,Fitness & Cross-Training,,
785,B00AK4F290, Clothing ,missing,"53% Nylon/42% Polyester/5% Spandex Zipper closure Machine Wash Nike dri fit fabric Double welt back pockets with single engineered pocket flap A lightweight, flat front short from Hurley that can be worn for either a casual or more dressed up look.",missing,Hurley Men's Dry Out Drifter Walkshort,missing,"Clothing, Shoes & Jewelry ", Men ," Surf, Skate & Street ", Shorts ,Flat Front,
823,B00ALPWCQE,Wrist Watches,unavailable,"This fits your .     Make sure this fitsby entering your model number.    P.when(""ReplacementPartsBulletLoader"").execute(function(module){ module.initializeDPX(); }) Alloy case and alloy strap Pointer show Daily water resistance(not for showering and swimming) Dial color:black Modern Silver Fashion Alloy Case Bracelet Black Dial Women Quartz Watches",missing,SODIAL(R) Alloy Case Bracelet Black Dial Modern Silver Fashion Women Quartz Watches,missing,"Clothing, Shoes & Jewelry ", Women , Watches ,,,
829,B00ALSYZFM, Necklaces ,unavailable,"Bubble Necklace, Statement Jewelry, Chunky Necklace, Bib Necklace turquoise headband with turquoise necklace in one package, total 2pcs Acrylic beaded linked necklace. Strands Braided Beads Chunky Bib Collar Necklace when you order Turquoise 3 row necklace you will get headband, if you not get it please request reshiping it,if worker don't reshipping plese request make refund $12.99usd, thanks",missing,"Turquoise 3 row teardrop Statement Jewelry, Chunky Necklace, Bubble Necklace",missing,"Clothing, Shoes & Jewelry ", Women , Jewelry ,Y-Necklaces,,
831,B00ALY4L9G, Boots ,missing,"100% Leather Imported Rubber sole Shaft measures approximately 8"" from arch Multi-texture snow boot featuring faux-shearling collar and waterproof KEEN.Dry membrane 200g KEEN.Warm thermal insulation Lugged outsole",missing,KEEN Women's Hoodoo II Winter Boot,missing,"Clothing, Shoes & Jewelry ", Women , Shoes ,Mid-Calf,,
841,B00AM481BO,Boots,unavailable,Made in the USA or Imported,missing,Top Moda Women's Pack-72 Lace Up Combat Boot,missing,"Clothing, Shoes & Jewelry ", Women , Shoes ,,,
852,B00AMPZO5E, Dance ,missing,"Features super soft, seamless, Microfiber yarn for superior comfort and performance Also features a comfortable 1"" lined elastic waistband and dyed-to-match gusset for color uniformity and moisture management Great for dance, exercise, recital, costuming, and fashion Hand wash, drip dry",missing,Adult Footless Tights T5600,missing,Sports & Outdoors , Sports & Fitness , Other Sports , Clothing , Women ,Tights
858,B00AMTXXWG, Athletic ,missing,"Leather-And-Mesh Made in USA Rubber sole High Arch Nike zoom unit in the heel The all new full-length Cushlon foam provides responsive cushioning and exceptional flexibility, softening your step and enhancing natural foot movement",missing,Nike Womens Air Pegasus+ 30 Running Shoe Distance Blue/Anthracite/Chambray Blue/Black,missing,"Clothing, Shoes & Jewelry ", Women , Shoes ,Running,,
864,B00AMZOSSS, Necklaces & Pendants ,missing,Retro Pendant Style Chain Charm Ornate Coat Sweater Vintage Necklace Globe Telescope Style Alloy Chain: 27 Inches Globe: 4 x 2.5 cm 1 Necklace / Order,missing,Leegoal Retro Pendant Globe Telescope Style Chain Charm Ornate Coat Sweater Vintage Necklace,missing,"Clothing, Shoes & Jewelry ", Girls , Jewelry ,Pendants,,
867,B00AN7D9IU,Shoulder Bags,unavailable,"Stylish large everyday hobo tote bag with gold-tone hardware. Roomy interior with 2 pocket-style organizers, 1 zippered pocket and 1 pouch-style zippered partion plus 1 exterior zipper pocket. 2 top handles and adjustable shoulder strap give you multiple carrying options. Made of manmade material Approximate Dimensions: Exterior - 11.5"" H X 20"" W X 6"" D; Interior - 10"" H X 20"" W X 6"" D; Handle - 8.5"" drop; Shoulder Strap - 26"" drop.",missing,MG Collection ACACIA Large Everyday Shopper Hobo Bag w/Shoulder Strap,missing,"Clothing, Shoes & Jewelry ", Women , Handbags & Wallets ,,,
876,B00ANHGGB2, Sandals ,missing,"100% leather Imported Synthetic sole Heel measures approximately 4"" Platform measures approximately 0.5"" Open-toe platform sandal featuring crisscross vamp straps and slingback strap featuring elastic for custom fit",missing,Nine West Women's Ripper Sandal,missing,"Clothing, Shoes & Jewelry ", Women , Shoes ,Heeled Sandals,,
880,B00ANKMMNU, Sandals ,missing,"100% Leather-and-synthetic Imported Cow Fur Synthetic sole Heel measures approximately 5.75"" Platform measures approximately 1.5""",missing,Nine West Women's Harriets Platform Sandal,missing,"Clothing, Shoes & Jewelry ", Women , Shoes ,Platforms & Wedges,,
885,B00ANMBA40, Athletic ,missing,"100% Leather Imported Rubber sole Perfect for skate, street or everyday.",missing,DC Women's Raif Se Lace-Up Fashion Sneaker,missing,"Clothing, Shoes & Jewelry ", Women , Shoes ,Skateboarding,,
893,B00AO306T8, Athletic ,missing,Synthetic Rubber sole synthetic,missing,Saucony Women's Ignition 4 Running Shoe,missing,"Clothing, Shoes & Jewelry ", Women , Shoes , Running ,Road Running,
908,B00AOHE7MG,Pumps,missing,"100% Textile Imported Synthetic sole Heel measures approximately 3.5"" Platform measures approximately 0.5""",missing,Nine West Women's Danee Peep-Toe Pump,missing,"Clothing, Shoes & Jewelry ", Women , Shoes ,,,
923,B00APO8WDI, Boots ,missing,"100% Leather Imported Rubber sole Shaft measures approximately 7"" from arch Heel measures approximately 1.25"" Boot opening measures approximately 11"" around Waterproof leather ankle boot featuring side zipper and adjustable ankle strap",missing,Teva Women's De La Vina Leather Low Boot,missing,"Clothing, Shoes & Jewelry ", Women , Shoes ,Mid-Calf,,
924,B00APQM1N8,,unavailable,"This fits your .     Make sure this fitsby entering your model number.    P.when(""ReplacementPartsBulletLoader"").execute(function(module){ module.initializeDPX(); }) Cloudburst construction with welded and taped critical seams, DWR treated fabric and YKK RCPU zippers provides a first line of weather defense Removable SafeZone compartment/pod system for camera and personal gear provides advanced protection for fragile gear and a modular option that easily fits into a hotel safe Fits up to prosumer DSLR body with attached zoom lens (up to 70–200mm f/2.8) and extended battery grip Padded 15” MacBook Pro compartment Ergonomic chassis system provides the perfect balance of support, cushioning, and breathability to ensure comfortable carrying configurations Quick access to hardware via weather-resistant zipper Flip-down organizer panel for accessories (batteries, lens cleaner)",missing,Thule Perspektiv Messenger Bag,missing,"Clothing, Shoes & Jewelry ", Luggage & Travel Gear ,Messenger Bags,,,
925,B00APR07MY," Tops, Tees & Blouses ",missing,100% Nylon Please refer to the Junior Casual Size Chart for this item,missing,PacificPlex Sheer Nylon Lace Racerback Tank Top,missing,"Clothing, Shoes & Jewelry ", Women , Clothing ,Tanks & Camis,,
931,B00APV121K,Sneakers,missing,100% Leather Imported Rubber sole Padded tongue and collar Adjustable hook-and-loop strap Playful car motif,missing,Stride Rite Cars SRT Light-up McQueen Sneaker (Toddler),missing,"Clothing, Shoes & Jewelry ", Boys , Shoes ,,,
944,B00AQFGFUI,Sneakers,missing,"100% Leather, Synthetic Imported Rubber sole Heel measures approximately 0.75"" Platform measures approximately 0.25"" Light-up sneaker featuring sequin and leather upper and hook-and-loop strap with Sleeping Beauty heart gem",missing,Stride Rite Disney Wish Light-Up Aurora Light-Up Sneaker (Toddler/Little Kid),missing,"Clothing, Shoes & Jewelry ", Girls , Shoes ,,,
967,B00AR2B91U, Bracelets ,missing,"Fits Pandora, Biagi, Chamilia and TrollBeads Charm Bracelets September Birthstone Color 4.5mm hole size Material: 925 Sterling Silver w/ 925 stamp, Crystals and Colophony Dimension: 12mm x 7mm",missing,Metal Factory Sterling Silver Crystal Ball Bead Charm Fits Pandora Chamilia Biagi Trollbeads European Bracelet,missing,"Clothing, Shoes & Jewelry ", Women , Jewelry , Charms & Charm Bracelets , Charms ,Bead
970,B00AR4J4XS,Sneakers,missing,100% Leather/Textile Synthetic sole Lace-up sneaker featuring removable OrthoLinte insole and multicolor outsole,missing,Skechers Kids 80685L GO Run Ride Sneaker,missing,"Clothing, Shoes & Jewelry ", Girls , Shoes ,,,
975,B00ARAR5U6, Gloves & Mittens ,unavailable,"Elastic Fabric,Acrylic Fit Palm Girth : 19cm/7.5 inches;Flat Size : 39 x 8cm/ 15.3 x 3.1 inches;Flat Wrist Girth : 18.5cm/ 7.3 inches Style : Fingerless;Length : Elbow;Suitable for : Lady Pattern : Solids;Brand : SourcingMap;Size Type : Regular Color : Black;Material : Elastic Fabric,Acrylic A perfect gift for Mother's Day.Net Weight : 39g;Package Content : 1 Pair x Fingerless Gloves",missing,Allegra K Stretchy Thumb Hole Winter Arm Warmer Gloves for Women Black,missing,"Clothing, Shoes & Jewelry ", Women , Accessories ,Cold Weather Gloves,,
981,B00ARCWZZE, Clothing ,missing,100% Cotton Imported Machine Wash Relaxed-fit sleeveless T-shirt featuring crew neckline and patch pocket at chest,missing,Carhartt Men's Workwear Pocket Sleeveless Midweight T-Shirt,missing,"Clothing, Shoes & Jewelry ", Men ," Uniforms, Work & Safety ", Work Utility & Safety ,Tops,
985,B00ARDCG52, Accessories ,missing,"75% Cotton, 16% Nylon, 6% Polyester, 3% Spandex 6 pack terry bootie socks help keep those little feet covered and warm all day and night Designed to stay on babies feet with soft elastic and roll back cuffs Made of a fabric blend for cozy softness and great fit",missing,Gerber Unisex Baby 6 Pack Socks,missing,"Clothing, Shoes & Jewelry ", Baby , Baby Girls ,Socks,,
987,B00ARDD50M, Clothing ,unavailable,100% Cotton Machine Wash Made of 100 percent cotton Lap shoulder neckline for ease of dressing Snap closure conveniently positioned for ease of changing baby's diaper Machine wash and dry,missing,Gerber Unisex-Baby  Frogs And Ducks 5 Pack Variety Onesies Brand,missing,"Clothing, Shoes & Jewelry ", Baby , Baby Girls ,Bodysuits,,
989,B00ARDD5FW, Clothing ,unavailable,100% Cotton Machine Wash Five-pack of onesies in assorted colors featuring lap neckline and snap closure,missing,Gerber Baby-Girls Five-Pack Solid Onesies,missing,"Clothing, Shoes & Jewelry ", Baby , Baby Girls ,Bodysuits,,
1001,B00ARKIC4O,Pumps,missing,"100% Synthetic Imported Synthetic sole Heel measures approximately 1.5"" Square-toe pump with decorative buckled vamp Soft System technology Cushioned insole",missing,LifeStride Women's Luscious Pump,missing,"Clothing, Shoes & Jewelry ", Women , Shoes ,,,
1005,B00ARN2UGC, Boots ,missing,"100% Manmade Imported Synthetic sole Intersecting straps exude relaxed luxury in this short, easy boot.",missing,LifeStride Women's X-Pat Boot,missing,"Clothing, Shoes & Jewelry ", Women , Shoes ,Ankle & Bootie,,
