,asin,category,color,description,details,name,size,department,demographic,division,subcategory,type,detail_type
0,B009L4OGDS, Earrings ,unavailable,6mm Crystal Ball Stud Earrings Plain Post and Backing Secure .925 Sterling Silver Stamped,missing,Sterling Silver Pink Crystal Ball Stud Earrings,missing,"Clothing, Shoes & Jewelry ", Women , Jewelry ,Stud,,
1,B009L5081Q, Novelty ,unavailable,"Size: One size only (small) Total Length: About 33.1"" / 84cm Waist: About 22"" / 56cm (before stretching) Front faux leather with lycra back, trendy and stylish LOCOMOLIFE",missing,Ninimour- Fashion Trendy Women's Stretchy Leggings Pants Tights (e),missing,"Clothing, Shoes & Jewelry ", Novelty & More , Clothing , Women ,Leggings,
2,B009L53QXI, Boots ,missing,"Synthetic Made in USA or Imported Synthetic sole model is a size 7, and size 7 fits her perfectly manmade material",missing,Dark Tan Faux Leather Bold Red Back Zipper Buckle Riding Boot Nakia Tan/Red,missing,"Clothing, Shoes & Jewelry ", Women , Shoes ,Mid-Calf,,
3,B009L5YU7O,Shoulder Bags,missing,"Leathette Imported fabric lining Snap closure 7.5"" shoulder drop 9"" high 15"" wide",missing,MG Collection Yelena Top Handle Soft Hobo Shoulder Bag,missing,"Clothing, Shoes & Jewelry ", Women , Handbags & Wallets ,,,
4,B009LB8CX6, Active ,missing,"Made in USA or Imported Merino wool blend Fiber Content: 70% Merino Wool, 29% Nylon, 1% Spandex Men's shoe size 8-12. Ladies' shoe size 9+ Made in USA",missing,Kirkland Signature Outdoor Trail Sock Merino Wool Blend (Pack of 4),missing,"Clothing, Shoes & Jewelry ", Women , Clothing ,Athletic Socks,,
5,B009LDP8UO,Jeans,missing,79% Cotton/19% Polyester/2% Spandex Imported Machine Wash Straight-leg jean in uninterrupted dark wash featuring contrast stitching and clean five-pocket styling Zip fly with button,missing,U.S. Polo Assn. Women's Straight Leg Jean,missing,"Clothing, Shoes & Jewelry ", Women , Clothing ,,,
6,B009LDP93A," Tops, Tees & Blouses ",missing,100% Cotton Imported Machine Wash Two flap pockets on chest Curved hemline,missing,U.S. Polo Assn. Women's Flannel Shirt,missing,"Clothing, Shoes & Jewelry ", Women , Clothing ,Polos,,
7,B009LDP9JY, Sweaters ,missing,70% Cotton/30% Polyester Imported Machine Wash Small pony logo on left chest Ribbed cuffs and hem,missing,U.S. Polo Assn. Women's Striped Signature Sweater,missing,"Clothing, Shoes & Jewelry ", Women , Clothing ,Pullovers,,
9,B009LEFPBA," Tops, Tees & Blouses ",missing,"100% Polyester Stand out from the crowd with this sexy layered top. Plus size blouse features scoop neck line. Dual Layer with inner tank top layer and outer semi-sheer poncho layer, Gorgeous floral print all over outer layer and solid black inner layer. Corsage detail. Available in Jr plus size 1XL, 2XL, 3XL. Made in the USA",missing,eVogues Plus size Sheer Layered Poncho Top,missing,"Clothing, Shoes & Jewelry ", Women , Clothing ,Blouses & Button-Down Shirts,,
14,B009LJAJAW, Novelty ,missing,"Officially Licensed Doctor Who Adult Unisex T-Shirt 100% Cotton Heavy Weight, Crew Neck, Standard Fit 18 Singles - 5.1 ounces Machine wash cold with like colors, tumble dry low, do not bleach, do not iron",missing,Ripple Junction Doctor Who Adult Unisex Vitruvian Angel Heavy Weight 100% Cotton Crew T-Shirt,missing,"Clothing, Shoes & Jewelry ", Novelty & More , Clothing , Men , Shirts ,T-Shirts
15,B009LL8NQC," Lingerie, Sleep & Lounge ",missing,"Nylon/Spandex Smoothing inner panel flattens waistline and tummy, Firm Control Non-restrictive fabric over bust for a great fit No-slip fabrication under hem to stay in place Fully adjustable stretch straps",missing,SPANX Assets Red Hot Top This! Camisole (1846),missing,"Clothing, Shoes & Jewelry ", Women , Clothing , Lingerie , Shapewear ,Tops
18,B009LT2DEC, Sandals ,missing,"100% Leather Imported Synthetic sole Heel measures approximately 1"" Slide styling allows for easy on off. Flexible, molded outsole provides shock absorption and stability for a more comfortable, confident stride. Durable, cushioned EVA foam footbed softens your steps.",missing,Easy Spirit Women's Maybeso Sandal,missing,"Clothing, Shoes & Jewelry ", Women , Shoes ,Flats,,
19,B009LT4S9U,Flats,missing,"100% Textile Imported Synthetic sole Heel measures approximately 1.25"" Sleek flat with cushioned instep and flexible sole",missing,Easy Spirit Women's Blastoff Skimmer,missing,"Clothing, Shoes & Jewelry ", Women , Shoes ,,,
20,B009LTL5VE, Athletic ,missing,"70% Suede, Mesh Imported Rubber sole",missing,Easy Spirit Women's Escape,missing,"Clothing, Shoes & Jewelry ", Women , Shoes ,Walking,,
21,B009LW0QZW, Jackets & Coats ,missing,"50% Wool 50% Poly Imported, designed by USA Zipper closure Doublju Men Wool/Cashmere Bomber Jacket Chest 38-Inch Top our-Pocket Hooded Knee Woolrich Hooded Winter Stand Collar Classic Pea Coat Wool Mackinaw Bomber Jacket Black Luxury Egan 39 Inch Shawl Doublju Men Winter Long Jacket with Button Breasted Slim Mackinaw Pure Cashmere 38-Inch Men's Winter Long Jacket Overcoat Wool 4-Pocket Doublju Mens Duffle Coat Utility Pocket Detail Doublju Men BGSD Men's Herringbone Doublju Mens Wantdo Luciano Alpine Swiss Trench Coat Perry Ellis Casual Top Coat Half Langford Parka Double Jacket Jackets Wool Half Match Men' Doublju Men BGSD Men's Herringbone Doublju Mens formal azul cielo wide a cuadros la franela old blanco el pa?uelo la camisa de seda la cremallera rayas (con rayas) el abrigo uniforme turquesa Doublju Men es de un solo color heavy de algod?n la seda rosado(a) sencillo mal small apretado rojo(a) low light claro(a) el algod?n short large madera de algod?n la seda tight cintur?n sencillo",missing,Doublju Mens Stylish Slim Fit Coat with Zipper Point,missing,"Clothing, Shoes & Jewelry ", Men , Clothing ,Wool & Blends,,
23,B009M7EG1Q,Leggings,missing,"75% Polyester / 25% Spandex Hand wash - Air Dry These premium footless leggings are stretchy, comfy, and versatile Made from 75% polyester and 25% spandex Polyester spandex, one size fits most, 34 inches long These must have leggings come in 14 bright colors, a closet staple!",missing,Greatlookz Fashion Fashionista Polyester Spandex Footless Leggings,missing,"Clothing, Shoes & Jewelry ", Women , Clothing ,,,
25,B009MA5OD2,Pumps,missing,"Synthetic Rubber sole Manmade Material Faux-Suede Colosed-Toe Heel Height: 5.27"" Origin: Made in China",missing,Ollio Women's Shoe Platform Faux Suede Point Toe Classic High Heel Multi Color Pump,missing,"Clothing, Shoes & Jewelry ", Women , Shoes ,,,
26,B009MA9FPU,Wrist Watches,unavailable,Imported,missing,2 PACK Geneva Silver and Gold Plated Classic Round CZ Ladies Boyfriend Watch,missing,"Clothing, Shoes & Jewelry ", Women , Watches ,,,
27,B009MA9GPE,Wrist Watches,unavailable,Imported Comfortable Bracelet Band width Foldover Clasp Large Round Face Approx 1.5 inches -36 mm with CZ Crystals Decorative Non-Functioning Sub-Dials Faux Chronograph Look - Quartz Movement 3 Watches packed together in One Bag - Ideal for Gift!,missing,"NYKKOLA Unisex Metal Watches, 3PCs Silver Gold and Rose Gold Plated Classic Round Geneva Ladies Watch",missing,"Clothing, Shoes & Jewelry ", Women , Watches ,,,
29,B009MB9A40,,missing,"HALF SIZE available stainless steel ring in 2mm comes in Prime Pristine pouch COMFORT FIT RING Best gift for engagement,wedding, valentine's day, Thanksgiving Day, Christmas and New Year",missing,Prime Pristine 2MM Stainless Steel Womens Rings High Polished Classy Domed Comfort Fit Wedding Bands,missing,"Clothing, Shoes & Jewelry ", Women ,Jewelry,,,
31,B009MB9J78,Wedding Rings,missing,"HALF SIZE available stainless steel ring in 6mm comes in Prime Pristine pouch COMFORT FIT RING Best gift for engagement,wedding, valentine's day, Thanksgiving Day, Christmas and New Year",missing,Prime Pristine 6MM Stainless Steel Mens Womens Rings High Polished Classy Domed Comfort Fit Wedding Bands,missing,"Clothing, Shoes & Jewelry ", Men , Jewelry ,,,
33,B009MHI11M,,missing,100% Cotton Machine Wash Baby Thermal Top is Cotton/Polyester Set comes gift tied with ribbon Standard US Sizes Great for lounging around,missing,Bottoms Out Men's Thermal/Flannel Gift Set,missing,"Clothing, Shoes & Jewelry ", Men ,Clothing,,,
34,B009MIMW3Y, Dresses ,missing,Cowl Neck Workwear Hand Wash Celebrity style Belt included,missing,ClosetOnline Celebrity Cowl Neck Tailored Workwear Evening Rockabilly Pencil Women's Dress,missing,"Clothing, Shoes & Jewelry ", Women , Clothing ,Work,,
35,B009MJ5G6S, Shirts ,missing,60% Cotton/40% Polyester Imported Machine Wash Mixed-stripe polo top with solid spread collar and banded short sleeves Embroidered logo at chest Two-button placket,missing,Nautica Men's Striped Anchor Deck Polo Shirt,missing,"Clothing, Shoes & Jewelry ", Men , Clothing ,Polos,,
36,B009MM96A2, Sandals ,missing,"100% Leather Imported Synthetic sole Heel measures approximately 1.75"" Platform measures approximately 1"" Slide-on sandal featuring cushioned footbed and leather upper with extended thong strap",missing,FitFlop Women's Walkstar 3 Nubuck Thong Sandal,missing,"Clothing, Shoes & Jewelry ", Women , Shoes ,Flip-Flops,,
38,B009MSBS7A,Shoulder Bags,missing,"Imported Hand crafted from genuine leather Measurements: 7.25H x 5.5"" W x 1"" D Strap drop is adjustable with a Pinch as long as 31"" to as low as you want Great for Travel or for a night out with just the essentials",missing,Goson Leather Purse Organizer Shoulder Bag 4 Pocket Micro Handbag Travel Wallet,missing,"Clothing, Shoes & Jewelry ", Women , Handbags & Wallets ,,,
40,B009NA44U0, Bracelets ,missing,Slide-on (not threaded) bead charm Single Core of Solid 925 Sterling Silver Approximately 4.5mm Hole Size Fully compatible with European-style Charm Bracelets.,missing,Sterling Silver Top Dog Bone Cat Paw Foot Print Black White Glass CZ Bead f/European Charm Bracelets,missing,"Clothing, Shoes & Jewelry ", Women , Jewelry , Charms & Charm Bracelets , Charms ,Bead
41,B009NA6AES, Underwear ,missing,"93% Cotton, 7% Spandex Machine Wash 4 way stretch Body defining Extra comfortable Modern fit",missing,Seven7 Men's 2 Pack Boxer Brief,missing,"Clothing, Shoes & Jewelry ", Men , Clothing ,Boxer Briefs,,
42,B009NB70WI, Dresses ,missing,PLEASE CHOOSE YOUR SIZE BASED ON BUST MEASUREMENT BELOW Bust (S)33-35 inches (M)35-37 inches (L)38-40 inches (XL)40-42 inches Length(shoulder to bottom hem) (S)33 inches (M)34 inches (L)35 inches (XL)36 inches Sleeve Length(shoulder to cuff hem) (S)5 inches (M)5 inches (L)5.5 inches (XL)6 inches Garment Care: Hand-wash only. Fabric: 70% Rayon 25% Polyester 5% Spandex. Hidden zipper at side seam for closure. Model in pictures is 5 feet 8 inches (173cm) tall.,missing,PattyBoutik Women's Faux Denim Detailed Mini Dress,missing,"Clothing, Shoes & Jewelry ", Women , Clothing ,Casual,,
44,B009NBA098, Sweaters ,missing,PLEASE CHOOSE YOUR SIZE BASED ON BUST MEASUREMENT BELOW Bust (S)33-35 inches (M)35-37 inches (L)38-40 inches (XL)40-42 inches Length(shoulder to bottom hem) (S)22 inches (M)23 inches (L)24 inches (XL)25 inches Sleeve Length(shoulder to cuff hem) (S)25 inches (M)25.5 inches (L)26 inches (XL)26.5 inches Garment Care: Machine Washable. Fabric: 95% Viscose 5% Nylon. Model in pictures is 5 feet 8 inches (173cm) tall,missing,PattyBoutik Women's Ribbed V Neck Empire Waist Sweater,missing,"Clothing, Shoes & Jewelry ", Women , Clothing ,Pullovers,,
45,B009NBG8CG, Scarves & Wraps ,missing,"100% Acrylic One size: 60"" x18"" Each side has a different print: one side is floral print, the other side is cherry print Brand: TrendsBlue High quality & comfortable, soft & lightweight",missing,Unique Two Sided Flower and Cherry Print Scarf - Different Colors Available,missing,"Clothing, Shoes & Jewelry ", Women , Accessories ,Fashion Scarves,,
46,B009NBG8N0, Scarves & Wraps ,missing,"100% Acrylic One size: 60"" x 23"" Brand: TrendsBlue High quality & comfortable, soft & lightweight Update: Now with 2 sides print!",missing,Premium Flower Print Scarf (2 Colors Available: Purple & Orange),missing,"Clothing, Shoes & Jewelry ", Women , Accessories ,Fashion Scarves,,
47,B009NII37W, Sweaters ,missing,"Classic solid color sweater vest, ultra versatile. V-neck. REGULAR FIT. Ribbed hem for extra comfort. Soft hand-touch, light weight 100% superior acrylic. Delicate setting, machine wash cold. Imported. PLEASE, SEE REVISED SIZE MEASUREMENTS IN ""Product Description"" BELOW.",missing,Blue Ocean Solid Color Sweater Vest,missing,"Clothing, Shoes & Jewelry ", Men , Clothing ,Vests,,
48,B009NKT9SW," Tops, Tees & Blouses ",missing,"BOLD & UNIQUE: Our Bolero Top is like three garments in one - it's designed to look like a blouse with a corset and bolero jacket over it. SEXY SPANISH FLAIR: Cut for curves, this dramatic tunic features a sweetheart neckline, super-wide cascading sleeves, and a flirty skirt flounce that skims the hips. SLIMMING & FLATTERING: Lace-outlined black corset panel creates hourglass illusion, while two side lace-ups and spaghetti ties in the back allow for an alluring custom fit. Brace yourself for a torrent of compliments! EASY CARE: Expertly crafted from lightweight, wrinkle-free, breathable stretch fabric (92% polyester/8% spandex): machine wash cold, line dry. See Dare size chart for perfect fit with just one measurement! MADE IN USA: Designed and made in San Francisco with Victorian, Gypsy, Witchy, Celtic, Gaelic, Rockabilly, Renaissance, Peasant, Pinup, Bohemian, Burning Man, Burlesque, and Steampunk influences.",missing,Dare to Wear Bolero Corset Top: Romantic Victorian Gothic Stylish Women's Tunic for Everyday Halloween Cosplay Festivals,missing,"Clothing, Shoes & Jewelry ", Women , Clothing ,Tunics,,
49,B009NMDPYY,Crossbody Bags,unavailable,"Genuine Leather Measurements: 7.5"" H x 8"" W x 1"" D Fully satin lined interior Strap drop is adjustable 14"" to 28"" Great for Travel or for a night out with just the essentials",missing,Soft Leather Cross Body Bag Purse Shoulder Bag 5 Pocket Organizer Micro HandbagTravel Wallet 7 colors,missing,"Clothing, Shoes & Jewelry ", Women , Handbags & Wallets ,,,
50,B009NN754E, Active ,missing,"This soft and comfortable velour hoodie set is the perfect outfit to relax in. This cozy zipper hoodie comes with two front pockets. The matching pants come with a comfortable drawstring waits, two front pockets, and two velcro back pockets. Wash in cold water with matching colors. Hang to dry. Do not bleach. 80% Cotton, 20% Polyester",missing,ToBeInStyle Women's Regular Drawstring Pants w/Hoodie Sweatshirt New Velour Set,missing,"Clothing, Shoes & Jewelry ", Women , Clothing ,Active Top & Bottom Sets,,
51,B009NO0H84,Pumps,missing,"Synthetic Rubber sole Manmade Material Mary-Jane Faux-Suede Heel Height: 5.27"" Origin: Made in China",missing,Ollio Women's Shoe Platform Fuax Suede Mary Jane High Heel Multi Color Pump,missing,"Clothing, Shoes & Jewelry ", Women , Shoes ,,,
53,B009NOX132, Athletic ,missing,"Synthetic-and-mesh Vibram sole Minimal rubber thickness maximizes ""foot feel"" and flexibility Soft TPU midsole further reduces thickness and weight for increased flexibility Stitched in polyurethane insole protects skin and foot tissue during longer runs Strategically placed vibram TC-1 Dura rubber for durability and weight reduction. UPPER- Mesh (polyester) + Microfabric (50% PU + 50% nylon)",missing,Vibram FiveFingers Men's Seeya LS Running Shoes,missing,"Clothing, Shoes & Jewelry ", Men , Shoes ,Running,,
54,B009NOZ8GU,,missing,Mylux Handbag uses High End PU leather SIZE: L 16 * H 12 * W 7.5 X-large handbag,missing,505443 MyLux WOMEN Designer X-Large Shoulder Tote Handbags,missing,"Clothing, Shoes & Jewelry ", Luggage & Travel Gear ,Briefcases,,,
55,B009NQ6V1Y,Leggings,missing,"Please buy the leggings from us : JNTworld. Our clothes are with trademark tag ""JNTworld"" for Quality Gurantee. We won't carry any responsibilities for order that purchased from other seller as they are infringed our trademark copyright. S : Waist 23""-25"", Hips 31""-33"", Full Length 41""-43"",M : Waist 25.5""-27"", Hips 33""-36"",Full Length 42""-44"", Hips 33""-36"",Full Length 42""-44"" L : Waist 27""-29"" , Hips 35""-38"", Full Length 43""-45"" XL: Waist 28""-30.5"" , Hips 37""-40"", Full Length 44""-46"" XXL: Waist 29.5""-32"" , Hips 38""-42"", Full Length 44""-46"", XXXL :Waist 30.5-33"", Hip : 39-43inch",missing,jntworld Women's Faux Leather High Waisted Leggings,missing,"Clothing, Shoes & Jewelry ", Women , Clothing ,,,
57,B009NQFMTQ, Socks & Hosiery ,missing,90% Nylon/10% Spandex Machine Wash Fashion legwear Anne Klein,missing,Anne Klein Women's 3 Pack Chevron Trouser Sock,missing,"Clothing, Shoes & Jewelry ", Women , Clothing ,Dress & Trouser Socks,,
60,B009NR5HCW,Pumps,missing,"100% Leather Imported Synthetic sole Heel measures approximately 3.5"" Platform measures approximately 0.75""",missing,Franco Sarto Women's Prance Pump,missing,"Clothing, Shoes & Jewelry ", Women , Shoes ,,,
61,B009NUU3SM, Bracelets ,missing,"Including one velvet bag printed brand name ""KONOV"" on it. Color: Silver Width: 18mm(0.71"") Length: 8.2""(20.8cm) Material: Stainless Steel",missing,KONOV Women's Stainless Steel Bangle Bracelet - Silver,missing,"Clothing, Shoes & Jewelry ", Women , Jewelry ,Cuff,,
62,B009NVJDQ4,Body Jewelry,unavailable,"Great quality jewelry! Ships from USA, Guaranteed!",missing,Silvertone Iced Out Multi Heart Style Adjustable Finger Ring Hand Chain Bracelet (J-90),missing,"Clothing, Shoes & Jewelry ", Women , Jewelry ,,,
63,B009NX5NH0, Sandals ,missing,100% Fabric Imported Synthetic sole,missing,Madden Girl Women's Tanduum Thong Sandal,missing,"Clothing, Shoes & Jewelry ", Women , Shoes ,Flip-Flops,,
64,B009NYCN22, Sandals ,missing,"100% Manmade Imported Synthetic sole Heel measures approximately 2.75"" Searing, laser-like cuts craft straps complete with an intricate and graphic pattern.",missing,Madden Girl Women's Hippieee Wedge Sandal,missing,"Clothing, Shoes & Jewelry ", Women , Shoes ,Platforms & Wedges,,
65,B009O2W4F4, Tops & Tees ,unavailable,"100% Cotton Officially Licensed Minecraft Merchandise Quality Products Music, Sports & Entertainment Memorabilia",missing,Minecraft - Creeper Glow Youth T-Shirt,missing,"Clothing, Shoes & Jewelry ", Boys , Clothing ,Tees,,
66,B009O5RW6C, Earrings ,unavailable,"Cute Kitty jewelry set - kitty face size: approx. 1.6cm x 1.2cm (0.6"" x 0.5"") Material: alloy and bling crystal rhinestones Necklace length – approx 45cm/17.7"" Ring diameter - approx 1.8cm/0.7"" [adjustable to fit any finger] Earring length – approx 1.4cm/0.6""",missing,World Pride Silver Kitty Rhinestone Crystal Fashion Jewelry Set with Pink Bow - Ring Earrings Necklace 3 in 1 Set,missing,"Clothing, Shoes & Jewelry ", Women , Jewelry ,Drop & Dangle,,
68,B009OA0YMG, Necklaces ,unavailable,Sterling Silver Pink Crystal Heart Shape Pendant Sterling Silver 18 Inch Cable Chain .925 Sterling Silver Stamped,missing,"Authentic stud earrings .925 Sterling Silver Pink Crystal Heart Shape Pendant Necklace,18""",missing,"Clothing, Shoes & Jewelry ", Women , Jewelry ,Pendants,,
70,B009OC6SYW," Lingerie, Sleep & Lounge ",missing,"Warner's Unbelievable Unwire Bra is the best of both worlds. The bendable, flexible ""unwire"" offers the support of an underwire without sacrificing the comfort of a wireless. It moves with you and will never poke, poke-through or dig in. It’s changing everything. Style #1526. Adjustable straps. Contour underwire cups. Double back hook-and-eye closure. Demi cup coverage. Nylon/elastane.Hand wash. Imported.",missing,Warner's Women's Unbelievable Unwire Bra,missing,"Clothing, Shoes & Jewelry ", Women , Clothing , Lingerie , Bras ,Everyday Bras
71,B009OICI8G," Tops, Tees & Blouses ",missing,100% Cotton Imported Machine Wash 100 percent cotton Women's contemporary fit,missing,Alternative Women's Scoop Neck Tee With Rib Sleeve,missing,"Clothing, Shoes & Jewelry ", Women , Clothing ,T-Shirts,,
73,B009OJEQ9Y," Lingerie, Sleep & Lounge ",missing,"100% Cotton Drawstring closure 100% Premium Cotton Flannel with Shrinkage Control. Double Brushed for soft hand feel inside and outside. Perfect for fall/winter chill or for someone who needs warmth year round. Elastic waist with drawstring for comfort sizing. Easy adjust. Two side seam pockets with enough room for cellphone, tissues, keys etc. Super comfortable and cozy, roomy fit, cut as per ASTM American standard sizes. Machine wash cold,gentle cycle / Tumble dry low / Only non-chlorine bleach when needed",missing,Noble Mount Womens Premium 100% Cotton Flannel Lounge Pants with Pockets & Drawstring,missing,"Clothing, Shoes & Jewelry ", Women , Clothing , Sleep & Lounge ,Bottoms,
74,B009OJF87S," Lingerie, Sleep & Lounge ",missing,"100% Cotton Imported Drawstring closure 100% Premium Cotton Flannel. Brushed for soft hand feel. Perfect for fall/winter chill Elastic waist with drawstring for comfort sizing Two side seam pockets Satin piping Machine wash cold,gentle cycle / Tumble dry low / Only non-chlorine bleach when needed",missing,Noble Mount Women's Cotton Flannel Lounge Pants (2 Pack),missing,"Clothing, Shoes & Jewelry ", Women , Clothing , Sleep & Lounge ,Bottoms,
75,B009OKGWMM," Tops, Tees & Blouses ",missing,"Pull On closure The soft cotton fabric of this fashionable long sleeve v-neck t-shirt will keep you in perfect comfort! You'll love the fit and feel of this casual long sleeve shirt. The deep v-neck plunge gives it a slight sexy flair while maintaining the easygoing and sleek look. Great for any situation, whether it be a night out with friends, or a relaxing day at home. Materials: 95% Cotton, 5% Spandex Care instructions: Machine wash in cool water. Tumble dry low. Sizes: Small, Medium, Large, 1X, 2X, and 3X Colors: Black, Dark Denim, Heather Grey, Marsala, White, and many more.",missing,ToBeInStyle Women's Long Sleeve V-Neck T-Shirt,missing,"Clothing, Shoes & Jewelry ", Women , Clothing ,Tunics,,
79,B009OX7LKG, Bracelets ,unavailable,"A different gift for each day! Set includes: 22 charms, one bracelet, and one necklace Imported Released for the 2012 Holiday Season but is a great gift for any year",missing,"Uno Aerre Advent Calendar with Necklace, Bracelet and Charms (2012 Version)",missing,"Clothing, Shoes & Jewelry ", Women , Jewelry , Charms & Charm Bracelets ,Charms,
80,B009OYO5O0, Bracelets ,missing,Tennis bracelet featuring round cubic zirconia stones in four-prong basket settings set in sterling silver Crafted in .925 sterling silver Imported,missing,Amazon Essentials Plated Sterling Silver Round Cut Cubic Zirconia Tennis Bracelet,missing,"Clothing, Shoes & Jewelry ", Women , Jewelry ,Tennis,,
82,B009OZU4DK, Shirts ,missing,"55% Cotton, 45% Polyester Imported Button closure Machine Wash Nice colors No iron",missing,Van Heusen Men's Short Sleeve Classic Plaid Button Down,missing,"Clothing, Shoes & Jewelry ", Men , Clothing ,Casual Button-Down Shirts,,
84,B009P0FMHC, Sweaters ,missing,"30% nylon PLEASE CHOOSE YOUR SIZE BASED ON BUST MEASUREMENT BELOW Bust (XS)31-33 inches (S)33-35 inches (M)35-37 inches (L)38-40 inches (XL)40-42 inches Length (shoulder to shortest/longest point) (XS)26, 31 inches (S)26.5, 32 inches (M)27, 33 inches (L)27.5, 34 inches (XL)28, 35 inches Sleeve Length (shoulder to cuff hem) (XS)24.5 inches (S)25 inches (M)25.5 inches (L)26 inches (XL)26.5 inches Garment Care: Machine Washable. Fabric: 70% Viscose 30% Nylon. Model in pictures is 5 feet 8-10 inches (173-178cm) tall wearing size S.",missing,PattyBoutik Women Ribbed Cascading Open Cardigan,missing,"Clothing, Shoes & Jewelry ", Women , Clothing ,Cardigans,,
86,B009P4G68W, Earrings ,missing,"With their round cut and four-prong setting, these stunning simulated-diamond stud earrings successfully blend beauty and affordability. Friction-back post Crafted in .925 sterling silver Cubic Zirconia is an affordable diamond alternative that reveals brilliant shine and a meticulous cut. Imported",missing,Sterling Silver Round Cubic Zirconia Stud Earrings (1.62 cttw),missing,"Clothing, Shoes & Jewelry ", Women , Jewelry ,Stud,,
87,B009P4G6AK, Earrings ,missing,"With these stunning princess-cut cubic zirconia studs, any woman can enjoy the look of expensive diamond earrings at a more affordable price. Cubic Zirconia is an affordable diamond alternative that reveals brilliant shine and a meticulous cut. Crafted in .925 sterling silver Friction-back post Imported",missing,Sterling Silver Princess Cut Cubic Zirconia Stud Earrings (1.3 cttw),missing,"Clothing, Shoes & Jewelry ", Women , Jewelry ,Stud,,
88,B009P4QAGA, Socks & Hosiery ,unavailable,49% Acrylic/28% Cotton/20% Polyester/2% Spandex/1% Rubber Machine Wash Smooth toe seam Wave sipping silicone non slip heel,missing,SPERRY Women's Stripes Skimmer,missing,"Clothing, Shoes & Jewelry ", Women , Clothing ,No Show & Liner Socks,,
90,B009P7M8R2, Shorts ,missing,97% Cotton/3% Spandex Imported Machine Wash 2.5-inch inseam Slanted back yoke detail Single and double welt pockets at back with logo buttons Stone embroidery,missing,Volcom Juniors Frochickie Short,missing,"Clothing, Shoes & Jewelry ", Women , Clothing ,Casual,,
91,B009P7SNUI, Necklaces ,missing,"Including one velvet bag printed brand name ""KONOV"" on it. Material: Stainless Steel; Pendant Height: 1.89""(4.8cm) Width: 0.9""(2.3cm) Chain Color: Silver; Chain Length: 18"" and 22"" Width: 3mm 2pcs Pendants arrive with 2pcs quality stainless steel chains.",missing,"KONOV 2pcs Mens Womens Couples Music Stainless Steel Pendant Love Necklace, 18 & 22 inch Chain, Black",missing,"Clothing, Shoes & Jewelry ", Women , Jewelry ,Pendants,,
