,asin,category,color,description,details,name,size,department,demographic,division,subcategory,type,detail_type
394,B00A24W7OQ," Coats, Jackets & Vests ",missing,Fabric: 100% Premium Quality Leather; Lining: 100% Polyester Viscose lining (Body & Sleeves). This Military Jacket comes with smooth and sleek princess seam panels. Extended cuffs & single rear vent makes this outerwear winter jacket more comfortable. Bespoke- Made To Measure or Standard USA/UK/European size Leather Jackets. Size Customization Available. 100% Money Back FIT GUARANTEE & Hassle-Free 30 days return.,missing,FE- Utili Dark Brown Leather Jacket Women - Genuine Goat Skin Military Trench Coats for Women,missing,"Clothing, Shoes & Jewelry ", Women , Clothing ,Leather & Faux Leather,,
395,B00A28SVJW,Rings,missing,"Including one velvet bag printed brand name ""KONOV"" on it. Material: Stainless Steel; Width: 31mm Available sizes: 8,9,10,11,12,13,14,15",missing,KONOV Vintage Gothic Skull Biker Stainless Steel Mens Ring,missing,"Clothing, Shoes & Jewelry ", Men , Jewelry ,,,
398,B00A2CYK6Q, Novelty ,unavailable,"Super Soft Funky Knee Socks Great Gift For Any Occasion 75% Cotton, 20% Polyester, 5% Spandex One Size Fits Most",missing,"Sock It To Me Phoenix Knee High Socks, Yellow/Red, One size fits women's shoe sizes 5-11",missing,"Clothing, Shoes & Jewelry ", Novelty & More , Clothing , Women , Socks & Hosiery ,Socks
399,B00A2DN4RG, Snowboarding ,unavailable,FUR CAT ANIMAL HOOD %100 CUSTOMER SATISFACTION %100 HIGH QUALITY SPECIAL DESIGN Great For Any Outdoor Activities Brand New and Fast Shipping,missing,Faux Fur Animal Hats Hoods Ski Red Wolf with Mittens Unisex Gloves Scarf with Paws,missing,Sports & Outdoors , Outdoor Recreation , Winter Sports , Clothing ,Men,
400,B00A2DQANG,Hats & Caps,unavailable,Chic&Cozy Brand New FUR PANDA ANIMAL HOOD %100 CUSTOMER SATISFACTION %100 HIGH QUALITY SPECIAL DESIGN Great For Any Outdoor Activities Brand New and Fast Shipping,missing,Faux FUR ANIMAL HATS HOODS PANDA WITH MITTENS ski UNISEX GLOVES SCARF WITH PAWS,missing,"Clothing, Shoes & Jewelry ", Women , Accessories ,,,
402,B00A2L5MFA, Necklaces ,unavailable,Money-back satisfaction guarantee,missing,Fashion Retro Silver Tone Chain Flower Vine Hollow Statement Bib Pendant Necklace,missing,"Clothing, Shoes & Jewelry ", Women , Jewelry ,Chains,,
403,B00A2L5N0E, Necklaces ,unavailable,Normally the transit time to USA is around 15 days Money-back satisfaction guarantee,missing,Fashion Retro Gold Tone Chain Flower Vine Hollow Adjustable Bib Pendant Necklace,missing,"Clothing, Shoes & Jewelry ", Women , Jewelry ,Chains,,
406,B00A2V4O90, Bracelets ,missing,"Including one velvet bag printed brand name ""KONOV"" on it. Color: Black & Silver Width: 8mm(0.32"") Length: 7.5""(19.1cm) Material: Genuine Leather & Stainless Steel",missing,"KONOV Black Leather Mens Bracelet Stainless Steel Clasp, 8mm - 7.5"", 8"", 8.5"", 9""",missing,"Clothing, Shoes & Jewelry ", Men , Jewelry ,Link,,
408,B00A2XMIHS,Jeans,missing,Imported Zipper closure Mid Rise Double Button Closure Fitted Through Knee Contoured Waistband to Prevent Gapping Bootcut Leg Opening,missing,WallFlower Juniors Vintage Collection Luscious Curvy Bootcut Jeans,missing,"Clothing, Shoes & Jewelry ", Women , Clothing ,,,
410,B00A311PMI,Wrist Watches,unavailable,"This fits your .     Make sure this fitsby entering your model number.    P.when(""ReplacementPartsBulletLoader"").execute(function(module){ module.initializeDPX(); }) Band Material: Silicone A great fashion accessory for lady, women, girls. Band Width: 2.0cm approx. 1 pc",missing,DOMIRE Ladies Brand Geneva Watch Classic Gel Crystal Silicone Jelly Watch,missing,"Clothing, Shoes & Jewelry ", Women , Watches ,,,
411,B00A34365Y,Wrist Watches,unavailable,"Sport-minded watch with round enclosed dial featuring alarm, backlight, 12/24-hour formatting, and day/date functions 44 millimeter metal case with glass dial window Quartz movement with analog display and digital sub-dials Silicone band with buckle closure",missing,U.S. Polo Assn. Sport Men's US9283 Grey Analog/Digital Chronograph Watch,missing,"Clothing, Shoes & Jewelry ", Men , Watches ,,,
412,B00A3436LS, Men ,missing,"Round watch featuring flag logo, skeleton hands, and a trio of digital subdials at center 44 mm metal case with glass dial window Quartz movement with analog and digital display Features silicone band with silver-tone links and buckle closure, alarm, EL backlight, and 12/24-hour formats Not water resistant",missing,U.S. Polo Assn. Sport Men's US9282 Silver-Tone Watch with White Silicone Band,missing,Sports & Outdoors , Outdoor Recreation , Outdoor Clothing , Accessories ,Sport Watches,
413,B00A343ALO,Wrist Watches,missing,"Sport-inspired watch with extra-wide band and multi-function dial featuring 24-hour dial ring, numbered bezel, and luminous indices Features daily alarm, timer, backlight, day/date functions, and red second hand 44 mm metal case with glass dial window Quartz movement with analog and digital displays Silicone band with silver-tone stripes, texturing at center, and buckle closure Not water resistant",missing,U.S. Polo Assn. Sport Men's US9284 Blue and Silver-Tone Analog/Digital Chronograph Watch,missing,"Clothing, Shoes & Jewelry ", Men , Watches ,,,
415,B00A36SYDQ, Clutches & Evening Bags ,missing,"Perfectly pleated satin fabric Magnet snap closure Front crystals,Interior slip pocket Dimensions:length 25cm(9.8 inches),width 9.5cm(3.7 inches), height 5cm(2 inches) A removeable Chain.",missing,Damara Womens Pleated Satin Flap Crystal Clutch Evening Bag,missing,"Clothing, Shoes & Jewelry ", Women , Handbags & Wallets ,Evening Bags,,
416,B00A37U8GQ," Lingerie, Sleep & Lounge ",missing,92% Nylon/8% Spandex Imported Hand Wash Push up pad for perfect cleavage and light lift Satin trim at the neckline for a unique look that is invisible under clothes,missing,Vassarette Women's Silken Heather Push Up Bra 75347,missing,"Clothing, Shoes & Jewelry ", Women , Clothing , Lingerie , Bras ,Everyday Bras
417,B00A3DK7QG, Sandals ,missing,"100% Elastic Imported Synthetic sole Heel measures approximately 5.25"" Platform measures approximately 1.75"" Made in China Leather Upper",missing,Jessica Simpson Women's Cosset Wedge Sandal,missing,"Clothing, Shoes & Jewelry ", Women , Shoes ,Platforms & Wedges,,
418,B00A3DLUEY, Sandals ,missing,"100% Leather Imported Synthetic sole Heel measures approximately 3"" Platform measures approximately 0.25"" Back-zip closure.",missing,Jessica Simpson Women's Eugenias Sandal,missing,"Clothing, Shoes & Jewelry ", Women , Shoes ,Heeled Sandals,,
419,B00A3EP4CM, Sandals ,missing,"100% Manmade Imported Synthetic sole Heel measures approximately 4.5"" Platform measures approximately 1.00""",missing,Jessica Simpson Women's Catalina Wedge Sandal,missing,"Clothing, Shoes & Jewelry ", Women , Shoes ,Platforms & Wedges,,
420,B00A3EZMT2,Jewelry Sets,missing,"YOU WILL RECEIVE: One Paved CZ Crystals Earrings and Pendant Necklace Jewelry Set. One Pair of Shining CZ Earrings with Matching Round CZ Charm Necklace MEASUREMENTS: CZ Earrings Diameter is Approx. 8mm, Post Length: Approx. 10mm, Post with Friction Back. CZ Necklace Charm Diameter is Approx. 10mm, Snake Necklace Length is Approx. 18 inches. This Eye-catching Necklace and Earrings Stud Jewelry Set is The Perfect Gift Idea for Yourself or Someone Special. These Earrings Deliver Day-to-Night Versatility with Gleaming Crystals Color: Green Crystal All BodyJ4You Items Are New And Unused. Guaranteed Satisfaction As We Offer 90 Day Money Back Guarantee.",missing,BodyJ4You Jewelry Set Crystal Ferido Ball Necklace with Stud Earrings,missing,"Clothing, Shoes & Jewelry ", Women , Jewelry ,,,
421,B00A3I4SLG, Shorts ,missing,100% Cotton Zipper closure Machine Wash Twill short featuring button-flap cargo pockets and zip fly with button closure Slant hand pockets Flap rear pockets,missing,Levi's Men's Ace Cargo Twill Short,missing,"Clothing, Shoes & Jewelry ", Men , Clothing ,Cargo,,
422,B00A3ID0II,Leggings,missing,These 1826 WOMEN'S sexy PLUS SIZE MOLETON pants are ultra comfortable and amazingly versatile. Fabric Content: 95% cotton 5% Spandex -Stretch Machine wash in cool water Tumble dry low. DO NOT BLEACH WOMENS sexy Plus size =SIZE-14-16-18-20-22 / SUPER COMFORTABLE HAND MEASUREMENT- 14= WAIST=36.5'' INSEAM=31'' HIPS=40'' 16= WAIST=38'' INSEAM=31'' HIPS=42'' 18= WAIST=39.5'' INSEAM=31'' HIPS=44'' 20= WAIST=42'' INSEAM=31'' HIPS=46'' 22= WAIST=44'' INSEAM=31'' HIPS=48'',missing,1826/926 Ponte Women's Butt Lift Plus Size Super Comfy Moleton Skinny Stretch Jeggings Legging Cotton Yoga Pants,missing,"Clothing, Shoes & Jewelry ", Women , Plus-Size ,,,
423,B00A3JFTPO,Pumps,missing,"100% Manmade Imported Synthetic sole Heel measures approximately 5"" Platform measures approximately 0.75"" These posh pumps are sure to get you noticed in all the right ways!",missing,Madden Girl Women's Fastenn Pump,missing,"Clothing, Shoes & Jewelry ", Women , Shoes ,,,
424,B00A3K4FVW,Pumps,missing,"100% Leather Imported Synthetic sole Heel measures approximately 3.25"" Platform measures approximately 0.75"" Classic pump with structured round toe and hidden platform Covered heel",missing,Madden Girl Women's Getta Pump,missing,"Clothing, Shoes & Jewelry ", Women , Shoes ,,,
425,B00A3L9CA0,Pumps,missing,Synthetic Synthetic sole Manmade Sole Lightweight Qupid Shoes - Fashion Forward Shoes Quality Man Made Materials,missing,Qupid Women's Neutral-330 Platform High Heel Stiletto,missing,"Clothing, Shoes & Jewelry ", Women , Shoes ,,,
426,B00A3MR1MK, Bracelets ,unavailable,925 Sterling Silver Bead Red Crystal Bead Charm Bead Covered with Red Crystal 4.5mm hole size .925 Sterling Silver Stamp,missing,.925 Sterling Silver Bead Red Crystal Bead Charm,missing,"Clothing, Shoes & Jewelry ", Women , Jewelry , Charms & Charm Bracelets , Charms ,Bead
427,B00A3Q5WMW," Coats, Jackets & Vests ",missing,Shell：Wool blends，100% Polyester lining Imported Dry Clean Only Duffle Coat with Faux Leather Trimmed Details Hooded wool coat with toggle closure and front flap pockets,missing,Charex@ Womens Winter Woolen Coat Long Slim Hooded Toggle Trench Coat,missing,"Clothing, Shoes & Jewelry ", Women , Clothing ,Wool & Pea Coats,,
430,B00A3TSIDY,Fashion Sneakers,missing,100% Oily Suede Imported Rubber sole Make life simpler in these easygoing SKECHERS® sneakers!,missing,Skechers Sport Men's Vigor 2.0 Legend Seeker Sneaker,missing,"Clothing, Shoes & Jewelry ", Men , Shoes ,,,
431,B00A3U731G, Scarves ,unavailable,"100% Acrylic Super soft cashmere feel Patterned in rich, classic plaids Dress for the weather in style A polished look to outerwear or sweaters 12 inches by 72 inches",missing,"SethRoberts-Plush Plaid Classic Cashmere Feel Men's Winter Scarf in Dark Brown, Black, Tan",missing,"Clothing, Shoes & Jewelry ", Men , Accessories ,Fashion Scarves,,
434,B00A4053YE,Necklaces,missing,7mm Herringbone Chain available in the size of your choice! Made in Korea! Great Quality Jewelry!,missing,JOTW Goldtone 7mm Brass Herringbone Chain - Available in All Lengths (C3500RDVAR),missing,"Clothing, Shoes & Jewelry ", Women , Jewelry ,,,
436,B00A40STZ4,Jewelry Making Chains,missing,High Quality Stainless Steel Face Width: 12mm Claddagh Heart Crown Ring Love Friendship Loyalty,missing,Jinique STR-0005 Stainless Steel Claddagh Ring,missing,"Arts, Crafts & Sewing ", Beading & Jewelry Making , Jewelry Findings ,,,
437,B00A410MKS, Bracelets ,unavailable,"THIS PRICE IS FOR TWO BRACELETS! Great Quality Jewelry! Ships from USA, Guaranteed!",missing,JOTW 2 Pieces of Black Five Row Spike Stretch Bracelet (X-1067),missing,"Clothing, Shoes & Jewelry ", Women , Jewelry ,Stretch,,
440,B00A45EDM2, Earrings ,unavailable,Titanium Hypoallergenic For Inverness 2000 Ear Piercing System Ideal for Sensitive Ears Medical Implant Grade Titanium,missing,Titanium Ball Piercing Earrings Pair in 3mm - Sterile Hypoallergenic For Sensitive Ears,missing,"Clothing, Shoes & Jewelry ", Women , Jewelry ,Stud,,
441,B00A4C98VG, Sandals ,missing,"100% Synthetic Imported Synthetic sole Heel measures approximately 4"" Platform measures approximately 2"" Heel Height: 3 3/4"" Fit: True to Size",missing,Michael Antonio Women's Globe2 Wedge Sandal,missing,"Clothing, Shoes & Jewelry ", Women , Shoes ,Platforms & Wedges,,
442,B00A4C9DJ8,Pumps,missing,"100% Manmade Imported Synthetic sole Heel measures approximately 4.25"" Platform measures approximately 1.00"" Made in China Man Made Upper",missing,Michael Antonio Women's Langston Pump,missing,"Clothing, Shoes & Jewelry ", Women , Shoes ,,,
443,B00A4CA1GW,Pumps,missing,"100% Synthetic Imported Synthetic sole Heel measures approximately 4.25"" Platform measures approximately 0.5 inches Round-toe pump in glossy finish featuring hidden platform and wrapped heel",missing,Michael Antonio Women's Loveme3 Pump,missing,"Clothing, Shoes & Jewelry ", Women , Shoes ,,,
445,B00A4CTM2Q,Rings,missing,"Including one velvet bag printed brand name ""KONOV"" on it. Material: Stainless Steel; Color: Black & Silver Width: 29mm Available sizes: 7-15",missing,"KONOV Biker Vintage Stainless Steel Angel Wing Mens Womens Ring, Black",missing,"Clothing, Shoes & Jewelry ", Men , Jewelry ,,,
447,B00A4IQ6V0, Sandals ,missing,"100% Leather/Textile Imported Lug Sole sole Heel measures approximately 1.5"" Platform measures approximately 0.5 inches Relaxed backstrap sandal with contrast-stitched detail Adjustable hook-and-loop strap N5 Comfort insole",missing,Naturalizer Women's Valero Sandal,missing,"Clothing, Shoes & Jewelry ", Women , Shoes ,Platforms & Wedges,,
450,B00A4LMUXK, Rings ,missing,High Quality Stainless Steel Width: 11mm Two Tone Grooved Maze Band,missing,Jinique STR-0009 Stainless Steel Two Tone Black IP with Grooved Maze Band Ring,missing,"Clothing, Shoes & Jewelry ", Women , Jewelry ,Bands,,
451,B00A4M71CO,Boots,missing,"96% Polyurethane, 4% Gore Imported Synthetic sole Heel measures approximately 2"" Stretch for fit and comfort Comfort wave Side gore Pleated vamp",missing,Easy Street Women's Prism Boot,missing,"Clothing, Shoes & Jewelry ", Women , Shoes ,,,
456,B00A4WJL54, Socks & Hosiery ,missing,"Pull On closure Size: One Size Fit All Regular - 5'-5'10, 100-175 Lb Materials: 100% Nylon. Handwash separately in cool water. Drip dry. Do not bleach.",missing,ToBeInStyle Women's Two Toned Jester Tights W/Reinforced Toe,missing,"Clothing, Shoes & Jewelry ", Women , Clothing ,Tights,,
457,B00A4WK03G,Top-Handle Bags,unavailable,Imported Material: PU Leather Size: 15x9.5x3 Back outside pocket with zipper closure Free Coin Wallet Fast Shipping from U.S.A,missing,Classic Fashion Faux Leather Large Tote Bags with Coin Wallet (Orange),missing,"Clothing, Shoes & Jewelry ", Women , Handbags & Wallets ,,,
458,B00A4X8ENS, Necklaces ,unavailable,"Gold Tone Plated 12.5"" at the outside diameter, 10"" and 1.24"" at the widest point. 8"" chin with 1.24"" extension",missing,World Pride Fashion Mirror Finish Choker Necklace Collar (Gold Tone Plated),missing,"Clothing, Shoes & Jewelry ", Women , Jewelry ,Pendants,,
460,B00A58ZK84,Earrings,unavailable,2.00 carat total weight stud earrings pink cubic zirconia AAAAA quality stones 6mm round each stone 1.00 carat ideal cut stones 925 sterling silver earrings hypoallergenic,missing,FANTOM JEWELRY 925 Sterling Silver 2.00 Carat Round Pink Cubic Zirconia Stud Earrings. 1.00,missing,"Clothing, Shoes & Jewelry ", Women , Jewelry ,,,
461,B00A5WICEY, Rings ,missing,.925 Sterling Silver Antique Finish Claddagh Ring .925 Sterling Silver Stamped friendship ring,missing,.925 Sterling Silver Claddagh Ring,missing,"Clothing, Shoes & Jewelry ", Women , Jewelry ,Statement,,
462,B00A5X0UPC," Lingerie, Sleep & Lounge ",missing,"Ultra light, silky-soft microfiber material with great stretchability Super cute boxer that gives a lot of coverage with very feminine lace décor May double-duty as safety pants underneath shorts and skirts 12 Pairs pack, in 8 different vibrant colors",missing,"Angelina Microfiber Boxer / Boy Shorts with Lace, 8 Colors Dozen(12) Pack",missing,"Clothing, Shoes & Jewelry ", Women , Clothing , Lingerie , Panties ,Boy Shorts
464,B00A683INW," Lingerie, Sleep & Lounge ",missing,"Zipper closure Hand Wash Only Silky 4 strap narrow satin suspender belt. Sizes - Medium: UK Dress 12, Large: UK Dress 14, X-Large: UK Dress 16. Handwash and dry separately.",missing,SILKY Womens/Ladies Narrow Satin Suspender Belt (1 Pair),missing,"Clothing, Shoes & Jewelry ", Women , Clothing , Lingerie ,Garters & Garter Belts,
466,B00A6CISJM,Casual Daypacks,unavailable,"This fits your .     Make sure this fitsby entering your model number.    P.when(""ReplacementPartsBulletLoader"").execute(function(module){ module.initializeDPX(); }) ◆ MATERIAL ◆ This retro chest bag was made of 16 Oz high density washed canvas, which has vintage style and long lasting durability. ◆ DIMENSIONS ◆ (L)6.7"" x (W)2.6"" x (H)10.8""; Item weighs 1.2 lbs, perfect size to fit an 9.7-inch iPad. ◆ FEATURES ◆ We introduced PEARL WOOL as lining material, making the canvas soft and durable. Fine leather trim perfectly decorate the whole cross body backpack. ◆ PRACTICAL DAYPACK ◆ Compact size comes with well located pockets allows handy access to daily necessaries. ◆ CONSIDERATE DESIGN ◆ Adjustable strap and the corresponding D hooks offers different ways to ware this lovely chest bag, wide enough straps proactively relieve the heavy load on your shoulders and comfortably to carry throughout all day.",missing,Gootium Canvas Sling Bag - Chest Pack Shoulder Backpack,missing,"Clothing, Shoes & Jewelry ", Luggage & Travel Gear , Backpacks ,,,
467,B00A6F5KUE, Necklaces ,missing,ULTIMATE COLLECTION SHIPS FROM USA! Quick Delivery Time!! This necklace measures 18 inches and the pendant measures 1 inch from left to right and .5 inches from top to bottom. Made in Korea! Great Quality Jewelry!,missing,JOTW Infinity Pendant with an 18 Inch Link Necklace - Goldtone or Silvertone Available,missing,"Clothing, Shoes & Jewelry ", Women , Jewelry ,Pendants,,
468,B00A6FJR2G, Sandals ,missing,"100% Synthetic Imported Synthetic sole Heel measures approximately 3.25"" Platform measures approximately 0.5""",missing,Lauren Ralph Lauren Women's Roseanne,missing,"Clothing, Shoes & Jewelry ", Women , Shoes ,Platforms & Wedges,,
469,B00A6FMB3S, Sandals ,missing,"100% Leather Imported Suede sole Heel measures approximately 2.75"" Open-toe dress sandal with contrast-trimmed toe strap Lightly padded footbed Adjustable buckle",missing,Lauren Ralph Lauren Women's Nyla Sandal,missing,"Clothing, Shoes & Jewelry ", Women , Shoes ,Heeled Sandals,,
470,B00A6G18VI,Rings,missing,High Quality Stainless Steel Band Width: 6mm Rainbow Color Crystals Comes with Free Gift Box,missing,Jinique STR-0011 Stainless Steel Mirror Polished Spinner Ring with Rainbow Color Crystals; Comes Box,missing,"Clothing, Shoes & Jewelry ", Women , Jewelry ,,,
472,B00A6G8STS, Rings ,missing,High Quality Stainless Steel Band Width: 8mm Duo Tone Blue IP Round CZ Centered Maze Inlay Comfort Fit,missing,Jinique STR-0013 Stainless Steel Duo Tone Blue IP Round CZ Centered Maze Inlay Band Ring,missing,"Clothing, Shoes & Jewelry ", Women , Jewelry ,Bands,,
477,B00A6KU3A6, Necklaces ,unavailable,925 Sterling Silver Combo Necklace May Simulated Cubic Zirconia AAAAA Quality Simulated Cubic Zirconia 18 inch rolo chain in Sterling Silver 925 1.50 Carat Simulated Cubic Zirconia Simulated Emerald Pendant,missing,Simulated Emerald Cubic Zirconia Necklace Pendant with 18 Inch Rolo Chain in 925 Sterling Silver,missing,"Clothing, Shoes & Jewelry ", Women , Jewelry ,Pendants,,
479,B00A6L1SSQ,Earrings,unavailable,2 pairs of stunning combo in sterling silver 925 sterling silver hypoallergenic stud earrings 1 pair of Simulated Ruby red colorCZ 6mm round earrings 2.00 carat total weight AAAAAA quality cubic zirconia 1 pair of Simulated Sapphire blue CZ color 6mm round earrings 2.00 carat total weight,missing,925 Sterling Silver 2.00 Carat Created Round Simulated Ruby Red and Created Simulated Sapphire Combo Cubic Zirconia,missing,"Clothing, Shoes & Jewelry ", Women , Jewelry ,,,
482,B00A6MZFH0," Tops, Tees & Blouses ",missing,Button closure PLEASE CHOOSE YOUR SIZE BASED ON BUST MEASUREMENT BELOW Bust (XS)31-33 inches (S)33-35 inches (M)35-37 inches (L)38-40 inches (XL)40-42 inches Length (shoulder to bottom hem) (XS)22.5 inches (S)23.5 inches (M)24.5 inches (L)25.5 inches (XL)26.5 inches Sleeve Length (shoulder to cuff hem) (XS)24.5 inches (S)25 inches (M)25.5 inches (L)26 inches (XL)26.5 inches Garment Care: Machine Washable. Fabric: 94% Rayon 6% Spandex. Model in pictures is 5 feet 8 inches (173cm) tall wearing size S,missing,PattyBoutik Women Bolero Button Long Sleeve Blouse,missing,"Clothing, Shoes & Jewelry ", Women , Clothing ,Blouses & Button-Down Shirts,,
483,B00A6QDRY4," Lingerie, Sleep & Lounge ",missing,"100% Polyester HOODED FLEECE ROBE - Super plush hooded fleece robe is extremely soft, warm and comfortable. This lightweight bathrobe is perfect for all day long. It is double stitched for durability. Featuring front pockets and a belt. PERFECT GIFT - Fleece hooded robe is the perfect gift for your loved ones. Great for chilly days in the house and when you take your dog outside. The hood makes it more comfortable and warm. Four different sizes available. SIZE CHART - X-SMALL/SMALL: Length: 44 inches, Shoulder: 18.5 inches, Chest: 42.5 inches. SMALL/MEDIUM: Length: 46.5 inches, Shoulder: 20 inches, Chest: 47 inches. MEDIUM/LARGE: Length: 47.5 inches, Shoulder: 22 inches, Chest: 51 inches. LARGE/X-LARGE: Length: 48.5 inches, Shoulder: 23.5 inches, Chest: 55 inches. MADE IN TURKEY - Plush hooded bathrobe is made of 100% Polyester Fleece. Machine washable, wash in warm water. Tumble dry low heat. CONFIDENCE IN TEXTILES - We believe in all our products. Our products are tested for harmful substances according to Oeko-Tex Standard 100. No matter your age you can get a lot from a bathrobe and we can help you find the right size and style.",missing,"TowelSelections Women's Robe, Plush Fleece Hooded Spa Bathrobe, Made in Turkey",missing,"Clothing, Shoes & Jewelry ", Women , Clothing , Sleep & Lounge ,Robes,
484,B00A6SOR7I, Socks & Hosiery ,missing,"90% Nylon / 10% Spandex Soft and stretchy microfiber tights offer full coverage and will hold snug around your waist | Variety of bright and vibrant colors can be matched to any outfit and will give you an elongated appearance Great for layering under dresses and skirts and can be paired with heels or boots | Great for birthday gifts, stocking stuffers, or as a last minute gift idea Matches any outfit and is perfect to wear at work, school, to a party, or fun event | Perfect accessory for Halloween costumes, theater performances, 80s parties, and recitals Great piece for layering under skirts, dresses, shorts, and costumes | Stand out and look your best at your next costume party or cosplay convention Sizing: X-Small-Medium: Fits most sizes: 4'11""-5'5"" , 80-150 lbs | Large-X-Large: Fits most sizes 5'7""-5'11"", 120-190 lbs",missing,HDE Women's Solid Color Stockings Opaque Microfiber Footed Tights,missing,"Clothing, Shoes & Jewelry ", Women , Clothing ,Tights,,
485,B00A6U2EYE, Men ,unavailable,Imported Self-winding automatic Case diameter: 41.50mm Mineral crystal Fantastic lumination on indices Water resistant to 200 meters (660 feet),missing,Orient Men's EM65009D Automatic Diver Watch,missing,Sports & Outdoors , Outdoor Recreation , Outdoor Clothing , Accessories ,Sport Watches,
487,B00A6V1N86, Clutches & Evening Bags ,missing,"Imported Pleated & Braided Satin Rhinestone Decoration on top & closure. Comes with a chain strap 22"" long. **Official CHICASTIC product made and sold exclusively by Chicastic.** Products sold by other sellers may vary. Please check seller before checking out. Measures - L - 9 in x H - 5 in x W - 1 in Braided Design is only on the front of the purse.",missing,Chicastic Pleated and Braided Rhinestone studded Wedding Evening Bridal Bridesmaid Clutch Purse,missing,"Clothing, Shoes & Jewelry ", Women , Handbags & Wallets ,Evening Bags,,
488,B00A6VE0S6, Rings ,missing,High Quality Stainless Steel Size 5~8 = 6mm Width; Size 9~14 = 8mm Width Stainless Steel Black IP with Matte Finish Center with Faceted Edges Comfort Fit,missing,Jinique STR-0014 Stainless Steel Black IP w/Matte Finish Center w/Faceted Edges Band Ring; Sold by Piece,missing,"Clothing, Shoes & Jewelry ", Women , Jewelry ,Bands,,
489,B00A6WZM1E, Earrings ,unavailable,This price is for TWELVE PAIRS of earrings! These hoop earrings measures 4 inches from left to right. Great Quality Jewelry!,missing,12 Pairs of Silvertone 4 Inch Hoop Earrings (X-960),missing,"Clothing, Shoes & Jewelry ", Women , Jewelry ,Hoop,,
490,B00A6XGBHM, Clothing ,missing,"100% Cotton Imported Zipper closure Machine Wash Slim-fit pant featuring slightly tapered legs, front slash pockets, and rear spade pockets Zip fly with button closure Hidden phone pocket",missing,Levi's Men's 511 Slim-Fit Hybrid Trouser Pant,missing,"Clothing, Shoes & Jewelry ", Men ," Surf, Skate & Street ", Pants ,Casual,
492,B00A6Y1U9K, Boots ,missing,Synthetic Imported Synthetic sole Shaft measures approximately 15.5 from arch Platform measures approximately 0.5 Manmade Sole Great for everyday wear,missing,Top Moda Women's COCO 1 Knee High Riding Boot,missing,"Clothing, Shoes & Jewelry ", Women , Shoes ,Knee-High,,
493,B00A6YTKD8,Leggings,missing,"95% Cotton, 5% Spandex Pull On closure Soft touch, comfortable, well adapts to the body Inseam: 24"" Machine wash 95% Cotton, 5% Spandex Imported",missing,Hollywood Star Fashion Stretch Cotton Capri Crop Seamed Leggings Tights,missing,"Clothing, Shoes & Jewelry ", Women , Clothing ,,,
